\c postgres postgres
CREATE EXTENSION mysql_fdw;
CREATE SERVER mysql_svr FOREIGN DATA WRAPPER mysql_fdw;
CREATE USER MAPPING FOR postgres SERVER mysql_svr OPTIONS(username 'foo', password 'bar');
CREATE FOREIGN TABLE department(department_id int, department_name text) SERVER mysql_svr OPTIONS(dbname 'testdb', table_name 'department');
CREATE FOREIGN TABLE employee(emp_id int, emp_name text, emp_dept_id int) SERVER mysql_svr OPTIONS(dbname 'testdb', table_name 'employee');
SELECT * FROM department LIMIT 10;
 department_id | department_name 
---------------+-----------------
(0 rows)

SELECT * FROM employee LIMIT 10;
 emp_id | emp_name | emp_dept_id 
--------+----------+-------------
(0 rows)

INSERT INTO department VALUES(generate_series(1,100), 'dept - ' || generate_series(1,100));
INSERT INTO employee VALUES(generate_series(1,100), 'emp - ' || generate_series(1,100), generate_series(1,100));
SELECT count(*) FROM department;
 count 
-------
   100
(1 row)

SELECT count(*) FROM employee;
 count 
-------
   100
(1 row)

EXPLAIN (COSTS FALSE) SELECT * FROM department d, employee e WHERE d.department_id = e.emp_dept_id LIMIT 10;
                       QUERY PLAN                       
--------------------------------------------------------
 Limit
   ->  Nested Loop
         Join Filter: (d.department_id = e.emp_dept_id)
         ->  Foreign Scan on department d
         ->  Materialize
               ->  Foreign Scan on employee e
(6 rows)

EXPLAIN (COSTS FALSE) SELECT * FROM department d, employee e WHERE d.department_id IN (SELECT department_id FROM department) LIMIT 10;
                               QUERY PLAN                                
-------------------------------------------------------------------------
 Limit
   ->  Nested Loop
         ->  Nested Loop Semi Join
               Join Filter: (d.department_id = department.department_id)
               ->  Foreign Scan on department d
               ->  Materialize
                     ->  Foreign Scan on department
         ->  Materialize
               ->  Foreign Scan on employee e
(9 rows)

SELECT * FROM department d, employee e WHERE d.department_id = e.emp_dept_id LIMIT 10;
 department_id | department_name | emp_id | emp_name | emp_dept_id 
---------------+-----------------+--------+----------+-------------
             1 | dept - 1        |      1 | emp - 1  |           1
             2 | dept - 2        |      2 | emp - 2  |           2
             3 | dept - 3        |      3 | emp - 3  |           3
             4 | dept - 4        |      4 | emp - 4  |           4
             5 | dept - 5        |      5 | emp - 5  |           5
             6 | dept - 6        |      6 | emp - 6  |           6
             7 | dept - 7        |      7 | emp - 7  |           7
             8 | dept - 8        |      8 | emp - 8  |           8
             9 | dept - 9        |      9 | emp - 9  |           9
            10 | dept - 10       |     10 | emp - 10 |          10
(10 rows)

SELECT * FROM department d, employee e WHERE d.department_id IN (SELECT department_id FROM department) LIMIT 10;
 department_id | department_name | emp_id | emp_name | emp_dept_id 
---------------+-----------------+--------+----------+-------------
             1 | dept - 1        |      1 | emp - 1  |           1
             1 | dept - 1        |      2 | emp - 2  |           2
             1 | dept - 1        |      3 | emp - 3  |           3
             1 | dept - 1        |      4 | emp - 4  |           4
             1 | dept - 1        |      5 | emp - 5  |           5
             1 | dept - 1        |      6 | emp - 6  |           6
             1 | dept - 1        |      7 | emp - 7  |           7
             1 | dept - 1        |      8 | emp - 8  |           8
             1 | dept - 1        |      9 | emp - 9  |           9
             1 | dept - 1        |     10 | emp - 10 |          10
(10 rows)

DELETE FROM employee WHERE emp_id = 10;
SELECT COUNT(*) FROM department LIMIT 10;
 count 
-------
   100
(1 row)

SELECT COUNT(*) FROM employee WHERE emp_id = 10;
 count 
-------
     0
(1 row)

UPDATE employee SET emp_name = 'Updated emp' WHERE emp_id = 20;
SELECT emp_id, emp_name FROM employee WHERE emp_name like 'Updated emp';
 emp_id |  emp_name   
--------+-------------
     20 | Updated emp
(1 row)

SELECT * FROM employee LIMIT 10;
 emp_id | emp_name | emp_dept_id 
--------+----------+-------------
      1 | emp - 1  |           1
      2 | emp - 2  |           2
      3 | emp - 3  |           3
      4 | emp - 4  |           4
      5 | emp - 5  |           5
      6 | emp - 6  |           6
      7 | emp - 7  |           7
      8 | emp - 8  |           8
      9 | emp - 9  |           9
     11 | emp - 11 |          11
(10 rows)

SELECT * FROM employee WHERE emp_id IN (1);
 emp_id | emp_name | emp_dept_id 
--------+----------+-------------
      1 | emp - 1  |           1
(1 row)

SELECT * FROM employee WHERE emp_id IN (1,3,4,5);
 emp_id | emp_name | emp_dept_id 
--------+----------+-------------
      1 | emp - 1  |           1
      3 | emp - 3  |           3
      4 | emp - 4  |           4
      5 | emp - 5  |           5
(4 rows)

SELECT * FROM employee WHERE emp_id IN (10000,1000);
 emp_id | emp_name | emp_dept_id 
--------+----------+-------------
(0 rows)

SELECT * FROM employee WHERE emp_id NOT IN (1) LIMIT 5;
 emp_id | emp_name | emp_dept_id 
--------+----------+-------------
      2 | emp - 2  |           2
      3 | emp - 3  |           3
      4 | emp - 4  |           4
      5 | emp - 5  |           5
      6 | emp - 6  |           6
(5 rows)

SELECT * FROM employee WHERE emp_id NOT IN (1,3,4,5) LIMIT 5;
 emp_id | emp_name | emp_dept_id 
--------+----------+-------------
      2 | emp - 2  |           2
      6 | emp - 6  |           6
      7 | emp - 7  |           7
      8 | emp - 8  |           8
      9 | emp - 9  |           9
(5 rows)

SELECT * FROM employee WHERE emp_id NOT IN (10000,1000) LIMIT 5;
 emp_id | emp_name | emp_dept_id 
--------+----------+-------------
      1 | emp - 1  |           1
      2 | emp - 2  |           2
      3 | emp - 3  |           3
      4 | emp - 4  |           4
      5 | emp - 5  |           5
(5 rows)

SELECT * FROM employee WHERE emp_id NOT IN (SELECT emp_id FROM employee WHERE emp_id IN (1,10));
ERROR:  unsupported expression type for deparse: 317
SELECT * FROM employee WHERE emp_name NOT IN ('emp - 1', 'emp - 2') LIMIT 5;
 emp_id | emp_name | emp_dept_id 
--------+----------+-------------
      3 | emp - 3  |           3
      4 | emp - 4  |           4
      5 | emp - 5  |           5
      6 | emp - 6  |           6
      7 | emp - 7  |           7
(5 rows)

SELECT * FROM employee WHERE emp_name NOT IN ('emp - 10') LIMIT 5;
 emp_id | emp_name | emp_dept_id 
--------+----------+-------------
      1 | emp - 1  |           1
      2 | emp - 2  |           2
      3 | emp - 3  |           3
      4 | emp - 4  |           4
      5 | emp - 5  |           5
(5 rows)

DELETE FROM employee;
DELETE FROM department;
DROP FOREIGN TABLE department;
DROP FOREIGN TABLE employee;
DROP USER MAPPING FOR postgres SERVER mysql_svr;
DROP SERVER mysql_svr;
DROP EXTENSION mysql_fdw CASCADE;
