\set MYSQL_HOST			'\'localhost\''
\set MYSQL_PORT			'\'3306\''
\set MYSQL_USER_NAME	'\'edb\''
\set MYSQL_PASS			'\'edb\''
-- Before running this file User must create database mysql_fdw_regress on
-- MySQL with all permission for 'edb' user with 'edb' password and ran
-- mysql_init.sh file to create tables.
\c contrib_regression
CREATE EXTENSION IF NOT EXISTS mysql_fdw;
CREATE SERVER mysql_svr FOREIGN DATA WRAPPER mysql_fdw
  OPTIONS (host :MYSQL_HOST, port :MYSQL_PORT);
CREATE USER MAPPING FOR public SERVER mysql_svr
  OPTIONS (username :MYSQL_USER_NAME, password :MYSQL_PASS);
-- Validate extension, server and mapping details
SELECT e.fdwname as "Extension", srvname AS "Server", s.srvoptions AS "Server_Options", u.umoptions AS "User_Mapping_Options"
  FROM pg_foreign_data_wrapper e LEFT JOIN pg_foreign_server s ON e.oid = s.srvfdw LEFT JOIN pg_user_mapping u ON s.oid = u.umserver
  WHERE e.fdwname = 'mysql_fdw'
  ORDER BY 1, 2, 3, 4;
 Extension |  Server   |       Server_Options       |    User_Mapping_Options     
-----------+-----------+----------------------------+-----------------------------
 mysql_fdw | mysql_svr | {host=localhost,port=3306} | {username=edb,password=edb}
(1 row)

-- Create foreign table and perform basic SQL operations
CREATE FOREIGN TABLE f_mysql_test(a int, b int)
  SERVER mysql_svr OPTIONS (dbname 'mysql_fdw_regress', table_name 'mysql_test');
SELECT a, b FROM f_mysql_test ORDER BY 1, 2;
 a | b 
---+---
 1 | 1
(1 row)

INSERT INTO f_mysql_test (a, b) VALUES (2, 2);
SELECT a, b FROM f_mysql_test ORDER BY 1, 2;
 a | b 
---+---
 1 | 1
 2 | 2
(2 rows)

UPDATE f_mysql_test SET b = 3 WHERE a = 2;
SELECT a, b FROM f_mysql_test ORDER BY 1, 2;
 a | b 
---+---
 1 | 1
 2 | 3
(2 rows)

DELETE FROM f_mysql_test WHERE a = 2;
SELECT a, b FROM f_mysql_test ORDER BY 1, 2;
 a | b 
---+---
 1 | 1
(1 row)

DROP FOREIGN TABLE f_mysql_test;
DROP USER MAPPING FOR public SERVER mysql_svr;
DROP SERVER mysql_svr;
-- Server with init_command.
CREATE SERVER mysql_svr1 FOREIGN DATA WRAPPER mysql_fdw
  OPTIONS (host :MYSQL_HOST, port :MYSQL_PORT, init_command 'create table init_command_check(a int)');
CREATE USER MAPPING FOR public SERVER mysql_svr1
  OPTIONS (username :MYSQL_USER_NAME, password :MYSQL_PASS);
CREATE FOREIGN TABLE f_mysql_test (a int, b int)
  SERVER mysql_svr1 OPTIONS (dbname 'mysql_fdw_regress', table_name 'mysql_test');
-- This will create init_command_check table in mysql_fdw_regress database.
SELECT a, b FROM f_mysql_test ORDER BY 1, 2;
 a | b 
---+---
 1 | 1
(1 row)

-- init_command_check table created mysql_fdw_regress database can be verified
-- by creating corresponding foreign table here.
CREATE FOREIGN TABLE f_init_command_check(a int)
  SERVER mysql_svr1 OPTIONS (dbname 'mysql_fdw_regress', table_name 'init_command_check');
SELECT a FROM f_init_command_check ORDER BY 1;
 a 
---
(0 rows)

-- Changing init_command to drop init_command_check table from
-- mysql_fdw_regress database
ALTER SERVER mysql_svr1 OPTIONS (SET init_command 'drop table init_command_check');
SELECT a, b FROM f_mysql_test;
 a | b 
---+---
 1 | 1
(1 row)

DROP FOREIGN TABLE f_init_command_check;
DROP FOREIGN TABLE f_mysql_test;
DROP USER MAPPING FOR public SERVER mysql_svr1;
DROP SERVER mysql_svr1;
-- Server with use_remote_estimate.
CREATE SERVER mysql_svr1 FOREIGN DATA WRAPPER mysql_fdw
  OPTIONS(host :MYSQL_HOST, port :MYSQL_PORT, use_remote_estimate 'TRUE');
CREATE USER MAPPING FOR public SERVER mysql_svr1
  OPTIONS(username :MYSQL_USER_NAME, password :MYSQL_PASS);
CREATE FOREIGN TABLE f_mysql_test(a int, b int)
  SERVER mysql_svr1 OPTIONS(dbname 'mysql_fdw_regress', table_name 'mysql_test');
-- Below explain will return actual rows from MySQL, but keeping costs off
-- here for consistent regression result.
EXPLAIN (VERBOSE, COSTS OFF) SELECT a FROM f_mysql_test WHERE a < 2 ORDER BY 1;
                                        QUERY PLAN                                        
------------------------------------------------------------------------------------------
 Sort
   Output: a
   Sort Key: f_mysql_test.a
   ->  Foreign Scan on public.f_mysql_test
         Output: a
         Local server startup cost: 10
         Remote query: SELECT `a` FROM `mysql_fdw_regress`.`mysql_test` WHERE ((`a` < 2))
(7 rows)

DROP FOREIGN TABLE f_mysql_test;
DROP USER MAPPING FOR public SERVER mysql_svr1;
DROP SERVER mysql_svr1;
-- Create server with secure_auth.
CREATE SERVER mysql_svr1 FOREIGN DATA WRAPPER mysql_fdw
  OPTIONS(host :MYSQL_HOST, port :MYSQL_PORT, secure_auth 'FALSE');
CREATE USER MAPPING FOR public SERVER mysql_svr1
  OPTIONS(username :MYSQL_USER_NAME, password :MYSQL_PASS);
CREATE FOREIGN TABLE f_mysql_test(a int, b int)
  SERVER mysql_svr1 OPTIONS(dbname 'mysql_fdw_regress', table_name 'mysql_test');
-- Below should fail with Warning of secure_auth is false.
SELECT a, b FROM f_mysql_test ORDER BY 1, 2;
WARNING:  MySQL secure authentication is off
 a | b 
---+---
 1 | 1
(1 row)

DROP FOREIGN TABLE f_mysql_test;
DROP USER MAPPING FOR public SERVER mysql_svr1;
DROP SERVER mysql_svr1;
-- Cleanup
DROP EXTENSION mysql_fdw;
